type,name,address,coordinates
JiHe,上海晋熙汽车销售服务有限公司,上海市浦东新区沪南公路4777弄258号,"121.58815079679414,31.07125350238548"
JiHe,上海弘仁星品汽车销售服务有限公司,上海市杨浦区军工路1601号,"121.52620859769735,31.2731365414002"
JiHe,上海明友泓浩汽车销售有限公司,上海市奉贤区南桥镇环城西路1488号,"121.44084348799153,30.92740536156965"
JiHe,上海天麦汽车销售服务有限公司,上海市静安区沪太路1111号,"121.42700529223337,31.27930570100733"
JiHe,上海浦之利汽车有限公司,上海市普陀区金沙江路2145号普罗娜广场B座一楼,"121.3683003389103,31.235786430141836"
JiHe,上海中隆汽车销售服务有限公司,上海闵行区中春路7169号,"121.34591649152894,31.13932515515941"
JiHe,上海吉庆新能源汽车销售有限公司,上海市松江区茸平路19号,"121.25517310735152,31.03346917498971"
